0.000000000  172.30.2.53 -> 34.245.205.65 SSH 566 Encrypted response packet len=500
0.000623892 34.245.205.65 -> 172.30.2.53  TCP 66 6257 > ssh [ACK] Seq=1 Ack=501 Win=3497 Len=0 TSval=2367299429 TSecr=676671274
0.748807998 34.245.205.65 -> 172.30.2.53  SSH 430 Encrypted request packet len=364
0.750240709  172.30.2.53 -> 34.245.205.65 SSH 126 Encrypted response packet len=60
0.750823224 34.245.205.65 -> 172.30.2.53  TCP 66 6257 > ssh [ACK] Seq=365 Ack=561 Win=3501 Len=0 TSval=2367300179 TSecr=676672024
0.752329294  172.30.2.53 -> 34.245.205.65 SSH 118 Encrypted response packet len=52
0.752903829 34.245.205.65 -> 172.30.2.53  TCP 66 6257 > ssh [ACK] Seq=365 Ack=613 Win=3501 Len=0 TSval=2367300181 TSecr=676672026
0.971980056 34.245.205.65 -> 172.30.2.53  SSH 166 Encrypted request packet len=100
0.976202294  172.30.2.53 -> 34.245.205.65 SSH 246 Encrypted response packet len=180
0.976787140 34.245.205.65 -> 172.30.2.53  TCP 66 6257 > ssh [ACK] Seq=465 Ack=793 Win=3500 Len=0 TSval=2367300405 TSecr=676672250
